{
  "$schema": "https://json-schema.org/draft/2020-12/schema",
  "$id": "https://osp.dev/schemas/provision-request.schema.json",
  "title": "ProvisionRequest",
  "description": "Request from an AI agent to provision a service resource from a provider",
  "type": "object",
  "required": ["offering_id", "tier_id", "project_name", "nonce"],
  "properties": {
    "offering_id": {
      "type": "string",
      "pattern": "^[a-z0-9-]+/[a-z0-9-]+$",
      "description": "Service offering ID from the provider's manifest (e.g., 'supabase/postgres')"
    },
    "tier_id": {
      "type": "string",
      "description": "Selected tier ID within the offering"
    },
    "project_name": {
      "type": "string",
      "minLength": 1,
      "maxLength": 100,
      "description": "Human-readable project name for the provisioned resource"
    },
    "region": {
      "type": "string",
      "description": "Desired deployment region — hard constraint (must be one of the offering's available regions)"
    },
    "preferred_region": {
      "type": "string",
      "description": "Soft region preference. Provider SHOULD honor when possible but MAY select the nearest available region. Ignored if 'region' is also specified."
    },
    "payment_method": {
      "type": "string",
      "enum": ["free", "sardis_wallet", "stripe_spt", "x402", "mpp", "invoice", "external"],
      "description": "Payment method to use for this provisioning request"
    },
    "payment_proof": {
      "type": "string",
      "description": "Payment proof (token, transaction hash, escrow ID, etc.) — format depends on payment_method"
    },
    "agent_public_key": {
      "type": "string",
      "description": "Ed25519 public key (base64url) for encrypting credentials returned to the agent"
    },
    "nonce": {
      "type": "string",
      "description": "Unique cryptographic nonce for replay protection (base64url encoded)"
    },
    "config": {
      "type": "object",
      "description": "Offering-specific configuration (e.g., database version, instance size, extensions)"
    },
    "webhook_url": {
      "type": "string",
      "format": "uri",
      "description": "URL for async provisioning callbacks when resource is ready"
    },
    "delegating_agent_id": {
      "type": "string",
      "description": "A2A: ID of the agent delegating this provisioning request (v1.1)"
    },
    "delegation_proof": {
      "type": "string",
      "description": "A2A: Ed25519 signature by the delegating agent authorizing this request (v1.1)"
    },
    "nhi_token_mode": {
      "type": "string",
      "enum": ["static", "short_lived", "federated"],
      "default": "static",
      "description": "NHI: preferred credential mode — static API key, short-lived token, or federated identity (v1.1)"
    },
    "budget": {
      "$ref": "#/$defs/BudgetConstraint",
      "description": "FinOps: budget constraint for this provisioning request (v1.1)"
    },
    "ttl_seconds": {
      "type": ["integer", "null"],
      "description": "Ephemeral environment TTL in seconds, null for persistent (v1.1)"
    },
    "trace_context": {
      "type": "string",
      "description": "OpenTelemetry W3C traceparent header value for distributed tracing (v1.1)"
    },
    "idempotency_key": {
      "type": "string",
      "format": "uuid",
      "description": "Client-generated key for request deduplication within 24-hour window"
    }
  },
  "$defs": {
    "AgentIdentity": {
      "type": "object",
      "required": ["method", "credential"],
      "description": "Agent identity and authentication claim. Agents use this to prove their identity to providers.",
      "properties": {
        "method": {
          "type": "string",
          "enum": ["ed25519_did", "oauth2_client", "api_key"],
          "description": "Identity method: ed25519_did (decentralized DID), oauth2_client (OAuth 2.0 client credentials), or api_key (provider-issued key)"
        },
        "credential": {
          "type": "string",
          "description": "Identity credential — DID string for ed25519_did, Bearer token for oauth2_client, API key for api_key"
        },
        "did_document": {
          "type": "object",
          "description": "Resolved DID document (optional, for ed25519_did method only)"
        },
        "nonce_signature": {
          "type": "string",
          "description": "Ed25519 signature over the request nonce, proving possession of the DID's private key (for ed25519_did method)"
        }
      }
    },
    "BudgetConstraint": {
      "type": "object",
      "description": "Budget constraint for cost-aware provisioning (v1.1)",
      "properties": {
        "max_monthly_cost": {
          "type": "string",
          "pattern": "^[0-9]+(\\.[0-9]{1,2})?$",
          "description": "Maximum monthly cost in provider's currency"
        },
        "max_total_cost": {
          "type": "string",
          "pattern": "^[0-9]+(\\.[0-9]{1,2})?$",
          "description": "Maximum total cost for TTL-based environments"
        },
        "currency": {
          "type": "string",
          "enum": ["USD", "EUR", "GBP", "USDC", "EURC"],
          "description": "Budget currency"
        },
        "alert_threshold_percent": {
          "type": "integer",
          "minimum": 1,
          "maximum": 100,
          "default": 80,
          "description": "Alert when budget consumption reaches this percentage"
        }
      }
    }
  }
}
